Tag,Content
Orgasm,"aaaaaaAAAAAAHHH!!! (Yuki zerdrückt dein Gesicht,|während sie einen ohrenbetäubenden Orgasmus hat.)"
StopPleasure,"(Sie drückt dich weg.) Nein, stopp!|Du bist nicht gut genug, das dauert zu lange."
LickEgg,"(Sie lässt ihr Höschen fallen, greift dich am Haar|und zieht dich ran.) Das ist deine Bestrafung für das Ei."
LickSub,"(Sie lässt ihr Höschen fallen, greift dich am|Haar und zieht dich ran.) An die Arbeit, meine Kleine."
NoPullEgg,"(Du lehnst dich weg, aber sie greift dich am Haar.)|Du hast das Ei reingesteckt. Bring es zu Ende!"
NoPullSub,"(Du lehnst dich weg, aber sie greift dich am Haar.)|Wo willst du denn hin, meine Kleine?"
