Stage,LoveReq,SubReq,VarReq,Interaction,Result,NextStage,LoveMod,SubMod,Function
0,0,0,,(Вытащить ремешки.),"Ты без проблем открываешь рюкзак.|Ты видишь несколько веревок в сумке.",10,0,0,
0,0,0,,(Потянуть сумку),"Хватит тянуть, ты, идиот!  Что ты делаешь?|(Она оттягивает от тебя сумку.)",30,0,0,SidneyAnnoy()
10,0,0,,(Закрыть ремни.),Ты осторожно вставляешь ремни обратно в петли.,0,0,0,
10,0,0,,(Украсть веревки.),Ты аккуратно крадешь веревки из ее сумки.,20,0,0,GetRope()
10,0,0,,(Спросить о веревках.),,30,0,0,SidneyRope()
10,0,0,,(Потянуть сумку),"Хватит тянуть, ты, идиот!  Что ты делаешь?|(Она оттягивает от тебя сумку.)",30,0,0,SidneyAnnoy()
20,0,0,,(Потянуть сумку),"Хватит тянуть, ты, идиот!  Что ты делаешь?|(Она оттягивает от тебя сумку.)",30,0,0,SidneyAnnoy()
